<?xml version="1.0" encoding="UTF-8"?>
<venue xmlns:xsi="http://www.w3.org/2001/XMLSchema-instance"
       xsi:noNamespaceSchemaLocation="venue.xsd"
       xmlns:xi="http://www.w3.org/2001/XInclude">

    <xi:include href="../groups.xml" />
    <xi:include href="../transmitters.xml" />
    
    <universes>
        <universe name="Personal Universe">
            <transmitters>
                <transmitter id="enttecTransmitter"/>
            </transmitters>
            <fixtures>
                <fixture startChannel="401" type="Chauvet ColorRail Master (no strobe)">
                    <groups>
                        <group name="bassist"/>
                    </groups>
                    <solver type="masterAtFull"/>
                </fixture>
                <fixture startChannel="402" type="Chauvet ColorRail Section">
                    <groups>
                        <group name="bassist"/>
                    </groups>
                    <solver type="hsb"/>
                    <solver type="fakeStrobe" countdownFrames="2"/>
                    <solver type="fakeUV"/>
                </fixture>
                <fixture startChannel="405" type="Chauvet ColorRail Section">
                    <groups>
                        <group name="bassist"/>
                    </groups>
                    <solver type="hsb"/>
                    <solver type="fakeStrobe" countdownFrames="2"/>
                    <solver type="fakeUV"/>
                </fixture>

                <fixture startChannel="408" type="Chauvet ColorRail Section">
                    <groups>
                        <group name="bassist"/>
                    </groups>
                    <solver type="hsb"/>
                    <solver type="fakeStrobe" countdownFrames="2"/>
                    <solver type="fakeUV"/>
                </fixture>

                <fixture startChannel="411" type="Chauvet ColorRail Section">
                    <groups>
                        <group name="bassist"/>
                    </groups>
                    <solver type="hsb"/>
                    <solver type="fakeStrobe" countdownFrames="2"/>
                    <solver type="fakeUV"/>
                </fixture>

                <fixture startChannel="414" type="Chauvet ColorRail Section">
                    <groups>
                        <group name="bassist"/>
                    </groups>
                    <solver type="hsb"/>
                    <solver type="fakeStrobe" countdownFrames="2"/>
                    <solver type="fakeUV"/>
                </fixture>

                <fixture startChannel="417" type="Chauvet ColorRail Section">
                    <groups>
                        <group name="bassist"/>
                    </groups>
                    <solver type="hsb"/>
                    <solver type="fakeStrobe" countdownFrames="2"/>
                    <solver type="fakeUV"/>
                </fixture>

                <fixture startChannel="420" type="Chauvet ColorRail Section">
                    <groups>
                        <group name="bassist"/>
                    </groups>
                    <solver type="hsb"/>
                    <solver type="fakeStrobe" countdownFrames="2"/>
                    <solver type="fakeUV"/>
                </fixture>

                <fixture startChannel="423" type="Chauvet ColorRail Section">
                    <groups>
                        <group name="bassist"/>
                    </groups>
                    <solver type="hsb"/>
                    <solver type="fakeStrobe" countdownFrames="2"/>
                    <solver type="fakeUV"/>
                </fixture>

                <fixture startChannel="427" type="Chauvet ColorRail Master (no strobe)">
                    <groups>
                        <group name="guitarist"/>
                    </groups>
                    <solver type="masterAtFull"/>
                </fixture>
                <fixture startChannel="428" type="Chauvet ColorRail Section">
                    <groups>
                        <group name="guitarist"/>
                    </groups>
                    <solver type="hsb"/>
                    <solver type="fakeStrobe" countdownFrames="2"/>
                    <solver type="fakeUV"/>
                </fixture>
                <fixture startChannel="431" type="Chauvet ColorRail Section">
                    <groups>
                        <group name="guitarist"/>
                    </groups>
                    <solver type="hsb"/>
                    <solver type="fakeStrobe" countdownFrames="2"/>
                    <solver type="fakeUV"/>
                </fixture>
                <fixture startChannel="434" type="Chauvet ColorRail Section">
                    <groups>
                        <group name="guitarist"/>
                    </groups>
                    <solver type="hsb"/>
                    <solver type="fakeStrobe" countdownFrames="2"/>
                    <solver type="fakeUV"/>
                </fixture>
                <fixture startChannel="437" type="Chauvet ColorRail Section">
                    <groups>
                        <group name="guitarist"/>
                    </groups>
                    <solver type="hsb"/>
                    <solver type="fakeStrobe" countdownFrames="2"/>
                    <solver type="fakeUV"/>
                </fixture>
                <fixture startChannel="440" type="Chauvet ColorRail Section">
                    <groups>
                        <group name="guitarist"/>
                    </groups>
                    <solver type="hsb"/>
                    <solver type="fakeStrobe" countdownFrames="2"/>
                    <solver type="fakeUV"/>
                </fixture>
                <fixture startChannel="443" type="Chauvet ColorRail Section">
                    <groups>
                        <group name="guitarist"/>
                    </groups>
                    <solver type="hsb"/>
                    <solver type="fakeStrobe" countdownFrames="2"/>
                    <solver type="fakeUV"/>
                </fixture>
                <fixture startChannel="446" type="Chauvet ColorRail Section">
                    <groups>
                        <group name="guitarist"/>
                    </groups>
                    <solver type="hsb"/>
                    <solver type="fakeStrobe" countdownFrames="2"/>
                    <solver type="fakeUV"/>
                </fixture>
                <fixture startChannel="449" type="Chauvet ColorRail Section">
                    <groups>
                        <group name="guitarist"/>
                    </groups>
                    <solver type="hsb"/>
                    <solver type="fakeStrobe" countdownFrames="2"/>
                    <solver type="fakeUV"/>
                </fixture>
            </fixtures>
        </universe>
    </universes>
</venue>