<?xml version="1.0" encoding="UTF-8"?>
<venue xmlns:xsi="http://www.w3.org/2001/XMLSchema-instance"
       xsi:noNamespaceSchemaLocation="venue.xsd"
       xmlns:xi="http://www.w3.org/2001/XInclude">

    <xi:include href="../groups.xml"/>
    <xi:include href="../transmitters.xml"/>

    <universes>
        <universe name="Main Universe">
            <transmitters>
                <transmitter id="enttecTransmitter"/>
                <transmitter id="sacnTransmitter"/>
            </transmitters>
            <fixtures>
                <fixtureSet src="Moving Spots.xml"/>
                <fixtureSet src="Moving Washes.xml"/>
                <fixtureSet src="Drum FadeCandy.xml"/>
                <fixtureSet src="Guitar FadeCandy.xml"/>
            </fixtures>
        </universe>
    </universes>
</venue>