<?xml version="1.0" encoding="UTF-8"?>
<venue xmlns:xsi="http://www.w3.org/2001/XMLSchema-instance"
       xsi:noNamespaceSchemaLocation="venue.xsd"
       xmlns:xi="http://www.w3.org/2001/XInclude">

    <xi:include href="../groups.xml" />
    <xi:include href="../transmitters.xml" />

    <universes>
        <universe name="Personal Universe">
            <transmitters>
                <transmitter id="sacnTransmitter"/>
            </transmitters>
            <fixtures>
                <fixture type="FadeCandy (program mode)" startChannel="480">
                    <groups>
                        <group name="guitarLEDs"/>
                    </groups>
                    <solver type="hsb"/>
                    <solver type="fakeUV"/>
                </fixture>
            </fixtures>
        </universe>
    </universes>
</venue>