<?xml version="1.0" encoding="UTF-8"?>
<venue xmlns:xsi="http://www.w3.org/2001/XMLSchema-instance" xsi:noNamespaceSchemaLocation="venue.xsd">
    <xi:include xmlns:xi="http://www.w3.org/2001/XInclude" href="../groups.xml" />
    <xi:include xmlns:xi="http://www.w3.org/2001/XInclude" href="../transmitters.xml" />
    <universes>
        <universe name="New Universe">
            <transmitters>
                <transmitter id="enttecTransmitter" />
            </transmitters>
            <fixtures>
                <fixture startChannel="301" type="Chinese Moving Wash">
                    <groups>
                        <group name="rearSides" />
                    </groups>
                    <solver type="hsb" />
                    <solver type="masterAtFull" />
                    <solver type="pan16bit" />
                    <solver type="tilt16bit" />
                    <solver type="fakeUV" />
                </fixture>
                <fixture startChannel="315" type="Chinese Moving Wash">
                    <groups>
                        <group name="rearSides" />
                    </groups>
                    <solver type="hsb" />
                    <solver type="masterAtFull" />
                    <solver type="pan16bit" />
                    <solver type="tilt16bit" />
                    <solver type="fakeUV" />
                </fixture>
                <fixture startChannel="329" type="Chinese Moving Wash">
                    <groups>
                        <group name="rearSides" />
                    </groups>
                    <solver type="hsb" />
                    <solver type="masterAtFull" />
                    <solver type="pan16bit" />
                    <solver type="tilt16bit" />
                    <solver type="fakeUV" />
                </fixture>
                <fixture startChannel="343" type="Chinese Moving Wash">
                    <groups>
                        <group name="rearSides" />
                    </groups>
                    <solver type="hsb" />
                    <solver type="masterAtFull" />
                    <solver type="pan16bit" />
                    <solver type="tilt16bit" />
                    <solver type="fakeUV" />
                </fixture>
            </fixtures>
        </universe>
    </universes>
</venue>